{
  "registry_schema": "ev4-architect-stage-validation-profiles@1.0.0",
  "registry_id": "ev4-architect-stage-validation-profiles",
  "registry_version": "1.0.0",
  "owner_repository": "rezahh107/EV4-Architect-Repo",
  "authorization_role": "validation_capability_only",
  "profiles": [
    {
      "stage_id": "/intake",
      "grounding": {
        "status": "explicit_active_contract",
        "authoritative_sources": [
          "manifests/architect-pipeline-manifest.v1.json",
          "02_PROJECT_INSTRUCTIONS_ACTIVE_OVERRIDES.md",
          "stages/01_INTAKE.md"
        ],
        "unresolved_semantic_decisions": [
          "Define a canonical machine-readable intake Artifact Schema.",
          "Define deterministic blocker classification and repair ownership for intake failures."
        ]
      },
      "artifact": {
        "identity": "intake-artifact",
        "version": "1.0.0",
        "schema_id": "undefined",
        "schema_path": "not_implemented"
      },
      "validation": {
        "status": "blocked_missing_semantics",
        "semantic_handler": "not_implemented",
        "structural_validation": "not_implemented",
        "semantic_validation": "not_implemented",
        "executable": false,
        "authorization_capable": false
      },
      "receipt": {"supported": false, "schema_id": "not_supported", "generator": "not_supported"},
      "bundle": {"supported": false, "independent_regeneration": false},
      "repair": {"ownership_status": "unresolved", "earliest_repair_owner": "undefined", "caller_selectable": false}
    },
    {
      "stage_id": "/research",
      "grounding": {
        "status": "explicit_active_contract",
        "authoritative_sources": [
          "manifests/architect-pipeline-manifest.v1.json",
          "02_PROJECT_INSTRUCTIONS_ACTIVE_OVERRIDES.md",
          "stages/02_RESEARCH.md"
        ],
        "unresolved_semantic_decisions": [
          "Publish the prose-defined ev4-research-payload@1.0.0 as a canonical JSON Schema.",
          "Define executable source freshness, source conflict, and downstream-permission checks.",
          "Define deterministic repair ownership for mixed research and downstream leakage failures."
        ]
      },
      "artifact": {
        "identity": "ev4-research-payload",
        "version": "1.0.0",
        "schema_id": "ev4-research-payload@1.0.0",
        "schema_path": "not_implemented"
      },
      "validation": {
        "status": "blocked_missing_semantics",
        "semantic_handler": "not_implemented",
        "structural_validation": "not_implemented",
        "semantic_validation": "not_implemented",
        "executable": false,
        "authorization_capable": false
      },
      "receipt": {"supported": false, "schema_id": "not_supported", "generator": "not_supported"},
      "bundle": {"supported": false, "independent_regeneration": false},
      "repair": {"ownership_status": "unresolved", "earliest_repair_owner": "undefined", "caller_selectable": false}
    },
    {
      "stage_id": "/decompose",
      "grounding": {
        "status": "explicit_active_contract",
        "authoritative_sources": [
          "manifests/architect-pipeline-manifest.v1.json",
          "contracts/ARCHITECT_PIPELINE_STAGE_ARTIFACT_V1.md",
          "schemas/ev4-architect-pipeline-stage-artifact.v1.schema.json",
          "stages/02_DECOMPOSE.md"
        ],
        "unresolved_semantic_decisions": []
      },
      "artifact": {
        "identity": "ev4-architect-pipeline-stage-artifact",
        "version": "1.1.0",
        "schema_id": "ev4-architect-pipeline-stage-artifact@1.1.0",
        "schema_path": "schemas/ev4-architect-pipeline-stage-artifact.v1.schema.json"
      },
      "validation": {
        "status": "full_transaction_implemented",
        "semantic_handler": "validate_decompose",
        "structural_validation": "json_schema",
        "semantic_validation": "registered_handler",
        "executable": true,
        "authorization_capable": true
      },
      "receipt": {"supported": true, "schema_id": "ev4-architect-stage-validation-receipt@1.1.0", "generator": "receipt_for"},
      "bundle": {"supported": true, "independent_regeneration": true},
      "repair": {"ownership_status": "deterministic", "earliest_repair_owner": "validator_derived", "caller_selectable": false}
    },
    {
      "stage_id": "/architectures",
      "grounding": {
        "status": "explicit_active_contract",
        "authoritative_sources": [
          "manifests/architect-pipeline-manifest.v1.json",
          "contracts/ARCHITECT_PIPELINE_STAGE_ARTIFACT_V1.md",
          "schemas/ev4-architect-pipeline-stage-artifact.v1.schema.json",
          "stages/03_ARCHITECTURES.md"
        ],
        "unresolved_semantic_decisions": []
      },
      "artifact": {
        "identity": "ev4-architect-pipeline-stage-artifact",
        "version": "1.1.0",
        "schema_id": "ev4-architect-pipeline-stage-artifact@1.1.0",
        "schema_path": "schemas/ev4-architect-pipeline-stage-artifact.v1.schema.json"
      },
      "validation": {
        "status": "full_transaction_implemented",
        "semantic_handler": "validate_architectures",
        "structural_validation": "json_schema",
        "semantic_validation": "registered_handler",
        "executable": true,
        "authorization_capable": true
      },
      "receipt": {"supported": true, "schema_id": "ev4-architect-stage-validation-receipt@1.1.0", "generator": "receipt_for"},
      "bundle": {"supported": true, "independent_regeneration": true},
      "repair": {"ownership_status": "deterministic", "earliest_repair_owner": "validator_derived", "caller_selectable": false}
    },
    {
      "stage_id": "/score-evidence",
      "grounding": {
        "status": "explicit_active_contract",
        "authoritative_sources": [
          "manifests/architect-pipeline-manifest.v1.json",
          "contracts/ARCHITECT_PIPELINE_STAGE_ARTIFACT_V1.md",
          "schemas/ev4-architect-pipeline-stage-artifact.v1.schema.json",
          "stages/04_SCORE_EVIDENCE.md"
        ],
        "unresolved_semantic_decisions": []
      },
      "artifact": {
        "identity": "ev4-architect-pipeline-stage-artifact",
        "version": "1.1.0",
        "schema_id": "ev4-architect-pipeline-stage-artifact@1.1.0",
        "schema_path": "schemas/ev4-architect-pipeline-stage-artifact.v1.schema.json"
      },
      "validation": {
        "status": "full_transaction_implemented",
        "semantic_handler": "validate_score_evidence",
        "structural_validation": "json_schema",
        "semantic_validation": "registered_handler",
        "executable": true,
        "authorization_capable": true
      },
      "receipt": {"supported": true, "schema_id": "ev4-architect-stage-validation-receipt@1.1.0", "generator": "receipt_for"},
      "bundle": {"supported": true, "independent_regeneration": true},
      "repair": {"ownership_status": "deterministic", "earliest_repair_owner": "validator_derived", "caller_selectable": false}
    },
    {
      "stage_id": "/score-audit",
      "grounding": {
        "status": "explicit_active_contract",
        "authoritative_sources": [
          "manifests/architect-pipeline-manifest.v1.json",
          "contracts/ARCHITECT_PIPELINE_STAGE_ARTIFACT_V1.md",
          "schemas/ev4-architect-pipeline-stage-artifact.v1.schema.json",
          "stages/05_SCORE_AUDIT.md"
        ],
        "unresolved_semantic_decisions": []
      },
      "artifact": {
        "identity": "ev4-architect-pipeline-stage-artifact",
        "version": "1.1.0",
        "schema_id": "ev4-architect-pipeline-stage-artifact@1.1.0",
        "schema_path": "schemas/ev4-architect-pipeline-stage-artifact.v1.schema.json"
      },
      "validation": {
        "status": "full_transaction_implemented",
        "semantic_handler": "validate_score_audit",
        "structural_validation": "json_schema",
        "semantic_validation": "registered_handler",
        "executable": true,
        "authorization_capable": true
      },
      "receipt": {"supported": true, "schema_id": "ev4-architect-stage-validation-receipt@1.1.0", "generator": "receipt_for"},
      "bundle": {"supported": true, "independent_regeneration": true},
      "repair": {"ownership_status": "deterministic", "earliest_repair_owner": "validator_derived", "caller_selectable": false}
    },
    {
      "stage_id": "/recommend",
      "grounding": {
        "status": "explicit_active_contract",
        "authoritative_sources": [
          "manifests/architect-pipeline-manifest.v1.json",
          "stages/06_RECOMMEND.md",
          "stages/06_RECOMMEND_v1.1_HARDENING_PATCH.md"
        ],
        "unresolved_semantic_decisions": [
          "Publish a canonical JSON Schema aligned to the active 1.1.0 hardening patch.",
          "Define deterministic tie, confirmation, and selected-candidate-lock failure semantics.",
          "Define executable earliest repair ownership across scoring and recommendation failures."
        ]
      },
      "artifact": {
        "identity": "ev4-recommend-payload",
        "version": "1.1.0",
        "schema_id": "ev4-recommend-payload@1.1.0",
        "schema_path": "not_implemented"
      },
      "validation": {
        "status": "blocked_missing_semantics",
        "semantic_handler": "not_implemented",
        "structural_validation": "not_implemented",
        "semantic_validation": "not_implemented",
        "executable": false,
        "authorization_capable": false
      },
      "receipt": {"supported": false, "schema_id": "not_supported", "generator": "not_supported"},
      "bundle": {"supported": false, "independent_regeneration": false},
      "repair": {"ownership_status": "unresolved", "earliest_repair_owner": "undefined", "caller_selectable": false}
    },
    {
      "stage_id": "/build-tree",
      "grounding": {
        "status": "explicit_active_contract",
        "authoritative_sources": [